{
 "id": "picon-punch",
 "type": "drink",
 "names": {
  "name": "Picon Punch"
 },
 "region": [
  "west",
  "california",
  "nevada"
 ],
 "text": {
  "short": "Bitter orange amer, a spoon of grenadine, soda, a float of brandy, a lemon twist. Basque America's drink, and not a Basque Country one.",
  "today": "Nevada made it the official state cocktail in 2025. In Bilbao the name means nothing.",
  "history": "It appears to have been put together in the American West, most likely San Francisco, in the last years of the 1800s — Amer Picon had just reached the coast, Gold Rush bar culture was running, and Basque boarding houses took it up as a house pour. One of the earliest printed versions is in the second edition of William Boothby's American Bartender, San Francisco, 1900, filed simply as Amer Picon."
 },
 "recipe": {
  "yield": "one glass",
  "ingredients": [
   "amer (Amer Picon where you can get it; in the United States, Torani Amer or the Ferino version)",
   "grenadine",
   "soda water",
   "a float of brandy",
   "a lemon twist"
  ],
  "method": [
   "Build over ice.",
   "Float the brandy.",
   "Twist the lemon over the top."
  ],
  "license": "proportions not reproduced — the houses that pour it do not publish them",
  "tier": "cited",
  "source": "wikipedia-picon-punch"
 },
 "sections": [
  {
   "heading": "The glass is regional",
   "body": "Northern Nevada pours it into a six-ounce stemmed glass — a stock Libbey 8054 Georgian Irish coffee, or a custom one from the Louie Picon Glass Company of Sparks. Elsewhere it lands in a highball or a Collins, at twice the volume.",
   "tier": "cited",
   "source": "libbey-8054"
  },
  {
   "heading": "The bitter has a supply problem",
   "body": "Amer Picon from Marseille is not reliably available in the United States, so bars pour Torani Amer instead — a San Francisco product, made for more than sixty years. In 2024 California required an ingredient re-certified and it vanished from the market; drinkers carried their own bottles into the bars. In December 2024 Torani gave the recipe and the global rights to Ferino Distillery in Reno for nothing, stopped making it in March 2025, and Ferino began in April. Nevada's state cocktail is now made in Nevada.",
   "tier": "cited",
   "source": "businesswire-ferino"
  },
  {
   "heading": "What it was for",
   "body": "Gaétan Picon built the original bitter in 1837 as a malaria remedy in the French Foreign Legion in Algeria — quinine, bark, roots, orange.",
   "tier": "cited",
   "source": "punch-picon"
  }
 ],
 "kin": [
  {
   "id": "louis-basque-corner",
   "how": "bills itself as home of it"
  },
  {
   "id": "jt-basque-gardnerville",
   "how": "calls it a mandatory beginning to dinner"
  },
  {
   "id": "wool-growers-bakersfield",
   "how": "pours one for $8"
  },
  {
   "id": "the-picon-supply",
   "how": "the long version of the bitter's supply problem"
  },
  {
   "id": "nevada",
   "how": "the state that made it official"
  },
  {
   "id": "picon-glass",
   "how": "the six ounces it is built in"
  },
  {
   "id": "brass-rail-alturas",
   "how": "poured at the far north-east corner of California"
  }
 ],
 "sources": [
  "wikipedia-picon-punch",
  "punch-picon",
  "wineenthusiast-picon",
  "euskalkazeta-picon",
  "sifestival-picon",
  "businesswire-ferino",
  "thisisreno-picon-panic",
  "libbey-8054"
 ],
 "provenance": "cited",
 "confidence": "high",
 "schema": 1,
 "updated": "2026-09-17",
 "images": [
  {
   "file": "picon-punch/picon-punch-picon-punch-5307913384.jpg",
   "source": "commons",
   "title": "File:Picon Punch (5307913384).jpg",
   "url": "https://upload.wikimedia.org/wikipedia/commons/7/75/Picon_Punch_%285307913384%29.jpg?utm_source=commons.wikimedia.org&utm_campaign=imageinfo&utm_content=original",
   "page_url": "https://commons.wikimedia.org/wiki/File%3APicon_Punch_%285307913384%29.jpg",
   "license": "CC BY-SA 2.0",
   "license_url": "https://creativecommons.org/licenses/by-sa/2.0/",
   "author": "Adrian Scottow from London, England",
   "credit": "Picon Punch",
   "alt": "Picon Punch",
   "date": "2010-12-30 22:14",
   "primary": true,
   "sha256": "71eb604db1df07b4cfac4ff3b0757f166ad68d04ecec3bf5c46fd534da846999"
  }
 ]
}
